No.     Time           Source                Destination           Protocol Length Info
     10 0.014287040    10.200.205.168        128.119.245.12        TCP      1417   50578 → 80 [ACK] Seq=1 Ack=1 Win=29312 Len=1351 TSval=2903054 TSecr=1141949977
     11 0.014294395    10.200.205.168        128.119.245.12        TCP      1417   50578 → 80 [ACK] Seq=1352 Ack=1 Win=29312 Len=1351 TSval=2903054 TSecr=1141949977
     12 0.016135344    10.200.205.168        128.119.245.12        TCP      1417   50578 → 80 [ACK] Seq=2703 Ack=1 Win=29312 Len=1351 TSval=2903054 TSecr=1141949977
     13 0.016149773    10.200.205.168        128.119.245.12        TCP      1417   50578 → 80 [ACK] Seq=4054 Ack=1 Win=29312 Len=1351 TSval=2903054 TSecr=1141949977
     14 0.017681879    10.200.205.168        128.119.245.12        TCP      1417   50578 → 80 [ACK] Seq=5405 Ack=1 Win=29312 Len=1351 TSval=2903055 TSecr=1141949977
     15 0.019731731    10.200.205.168        128.119.245.12        TCP      1417   50578 → 80 [ACK] Seq=6756 Ack=1 Win=29312 Len=1351 TSval=2903055 TSecr=1141949977
     20 0.028440371    128.119.245.12        10.200.205.168        TCP      66     80 → 50578 [ACK] Seq=1 Ack=2703 Win=34432 Len=0 TSval=1141949991 TSecr=2903054
     24 0.031089042    128.119.245.12        10.200.205.168        TCP      66     80 → 50578 [ACK] Seq=1 Ack=5405 Win=39808 Len=0 TSval=1141949994 TSecr=2903054
     25 0.031329406    128.119.245.12        10.200.205.168        TCP      66     80 → 50578 [ACK] Seq=1 Ack=6756 Win=42752 Len=0 TSval=1141949994 TSecr=2903055
